{
  "$schema": "./schema.json",
  "version": "1.0.0",
  "updated": "2026-10-06",
  "custom_model_data_base": 870000,
  "assets": [
    {
      "id": "weapon.suld_ild_tenger",
      "name": "Ild Tenger",
      "name_mn": "Тэнгэрийн Илд",
      "type": "weapon",
      "subtype": "saber",
      "rarity": "legendary",
      "item_level": 60,
      "class": "legendary_relic",
      "class_compat": ["baatar", "khulegchin"],
      "source": "meshy",
      "source_note": "Meshy text-to-3D preview -> refine (meshy-7.1, 4K, PBR). Real textured GLB downloaded (28.6MB, 30147 tris, baseColor+metalRough+normal) and rendered in Blender headless (assets/previews/suld_ild_tenger_hero.png). NOTE: vanilla Minecraft Java item models are box-only, so the in-game model (resourcepack/.../suld_ild_tenger.json) is a Blockbench low-poly box model guided by the Meshy silhouette+textures; the Meshy mesh itself is the promo/NPC/reference asset, not a native Java item mesh.",
      "meshy_preview_task_id": "01a110c4-130e-70d5-be0a-5edd28a6c70c",
      "meshy_refine_task_id": "01a110ce-2f2a-7516-ad4c-e166e13ffa20",
      "meshy_status": "refine_SUCCEEDED; textured GLB downloaded + rendered",
      "meshy_hero_render": "assets/previews/suld_ild_tenger_hero.png",
      "meshy_tris": 30147,
      "bbmodel": "assets/models/blockbench/suld_ild_tenger.bbmodel",
      "minecraft_model": "resourcepack/assets/suld/models/item/suld_ild_tenger.json",
      "texture_file": "resourcepack/assets/suld/textures/item/suld_ild_tenger.png",
      "preview_render": "assets/previews/suld_ild_tenger.png",
      "base_item": "minecraft:netherite_sword",
      "custom_model_data": 870001,
      "polycount": 30,
      "texture_resolution": "16x16",
      "validated": { "bbmodel_validate": "passed", "errors": 0, "warnings": 0 },
      "status": "needs_review",
      "version": "1.0.0",
      "lore_mn": "Тэнгэрийн илд — хойд зүгийн тэнгэрийн дор давтагдсан домогт ир.",
      "lore_en": "A blade forged under the eternal sky; its edge remembers the horizon."
    },
    {
      "id": "item.suld_relic_token",
      "name": "Relic Token",
      "name_mn": "Сүлдний Тэмдэг",
      "type": "item",
      "subtype": "token",
      "rarity": "epic",
      "item_level": 1,
      "source": "procedural",
      "texture_file": "resourcepack/assets/suld/textures/item/suld_relic_token.png",
      "texture_resolution": "16x16",
      "status": "concept",
      "version": "1.0.0"
    }
  ]
}
